{
  "type": "lolbin-details",
  "version": 2,
  "id": "588e068a-49cc-4390-85a6-2f9025919914",
  "created_by_ref": "@Nounou_Mbeiri",
  "created": "2023-09-14T19:59:11.000Z",
  "modified": "2026-10-16T00:00:00.000Z",
  "name": "mshta.exe",
  "image": "mshta.exe",
  "description": "Mshta.exe is a utility that executes Microsoft HTML Applications (HTA) files.",
  "attack": {
    "id": "T1218.005",
    "name": "Mshta",
    "type": "technique",
    "url": "https://attack.mitre.org/techniques/T1218/005",
    "version": "20.0"
  },
  "summary": [
    "Execute malicious payloads",
    "Execute a malicious hta file",
    "Executed malicious JavaScript code",
    "Execute HTML pages",
    "Execute malicious VBScript",
    "Execute DLLs",
    "Download and execute applications from a remote server"
  ],
  "required_privileges": [
    "User"
  ],
  "paths": [
    "c:\\windows\\system32\\mshta.exe",
    "c:\\windows\\syswow64\\mshta.exe"
  ],
  "hashes": {
    "MD5": "06B02D5C097C7DB1F109749C45F3F505"
  },
  "capabilities": [
    "Execute",
    "Download",
    "Alternate data streams"
  ],
  "platforms": [
    "windows"
  ],
  "associated_kill_chain_phases": [
    "TA0005:Stealth:T1218.005"
  ],
  "techniques": [
    {
      "id": "T1218.005",
      "name": "Mshta",
      "url": "https://attack.mitre.org/techniques/T1218/005",
      "tactics": [
        "Stealth"
      ]
    }
  ],
  "relationship": {
    "associated_apts": [
      {
        "name": "APT29",
        "attack_id": "G0016",
        "evidence": [
          "uses T1218.005",
          "names mshta.exe"
        ]
      },
      {
        "name": "APT32",
        "attack_id": "G0050",
        "evidence": [
          "uses T1218.005",
          "names mshta.exe"
        ]
      },
      {
        "name": "APT38",
        "attack_id": "G0082",
        "evidence": [
          "uses T1218.005",
          "names mshta.exe"
        ]
      },
      {
        "name": "Confucius",
        "attack_id": "G0142",
        "evidence": [
          "uses T1218.005",
          "names mshta.exe"
        ]
      },
      {
        "name": "Earth Lusca",
        "attack_id": "G1006",
        "evidence": [
          "uses T1218.005",
          "names mshta.exe"
        ]
      },
      {
        "name": "FIN7",
        "attack_id": "G0046",
        "evidence": [
          "uses T1218.005",
          "names mshta.exe"
        ]
      },
      {
        "name": "Gamaredon Group",
        "attack_id": "G0047",
        "evidence": [
          "uses T1218.005",
          "names mshta.exe"
        ]
      },
      {
        "name": "Inception",
        "attack_id": "G0100",
        "evidence": [
          "uses T1218.005"
        ]
      },
      {
        "name": "Kimsuky",
        "attack_id": "G0094",
        "evidence": [
          "uses T1218.005",
          "names mshta.exe"
        ]
      },
      {
        "name": "Lazarus Group",
        "attack_id": "G0032",
        "evidence": [
          "uses T1218.005",
          "names mshta.exe"
        ]
      },
      {
        "name": "LazyScripter",
        "attack_id": "G0140",
        "evidence": [
          "uses T1218.005",
          "names mshta.exe"
        ]
      },
      {
        "name": "MuddyWater",
        "attack_id": "G0069",
        "evidence": [
          "uses T1218.005",
          "names mshta.exe"
        ]
      },
      {
        "name": "Mustang Panda",
        "attack_id": "G0129",
        "evidence": [
          "uses T1218.005",
          "names mshta.exe"
        ]
      },
      {
        "name": "SideCopy",
        "attack_id": "G1008",
        "evidence": [
          "uses T1218.005",
          "names mshta.exe"
        ]
      },
      {
        "name": "Sidewinder",
        "attack_id": "G0121",
        "evidence": [
          "uses T1218.005",
          "names mshta.exe"
        ]
      },
      {
        "name": "TA2541",
        "attack_id": "G1018",
        "evidence": [
          "uses T1218.005",
          "names mshta.exe"
        ]
      },
      {
        "name": "TA551",
        "attack_id": "G0127",
        "evidence": [
          "uses T1218.005",
          "names mshta.exe"
        ]
      }
    ],
    "associated_campaigns": [
      {
        "name": "C0015",
        "attack_id": "C0015",
        "evidence": [
          "uses T1218.005",
          "names mshta.exe"
        ]
      },
      {
        "name": "Operation Dust Storm",
        "attack_id": "C0016",
        "evidence": [
          "uses T1218.005",
          "names mshta.exe"
        ]
      }
    ],
    "associated_malware": [
      {
        "name": "BabyShark",
        "attack_id": "S0414",
        "evidence": [
          "uses T1218.005",
          "names mshta.exe"
        ]
      },
      {
        "name": "Lumma Stealer",
        "attack_id": "S1213",
        "evidence": [
          "uses T1218.005",
          "names mshta.exe"
        ]
      },
      {
        "name": "Metamorfo",
        "attack_id": "S0455",
        "evidence": [
          "uses T1218.005",
          "names mshta.exe"
        ]
      },
      {
        "name": "NanHaiShu",
        "attack_id": "S0228",
        "evidence": [
          "uses T1218.005",
          "names mshta.exe"
        ]
      },
      {
        "name": "POWERSTATS",
        "attack_id": "S0223",
        "evidence": [
          "uses T1218.005",
          "names mshta.exe"
        ]
      },
      {
        "name": "Pteranodon",
        "attack_id": "S0147",
        "evidence": [
          "uses T1218.005",
          "names mshta.exe"
        ]
      },
      {
        "name": "Revenge RAT",
        "attack_id": "S0379",
        "evidence": [
          "uses T1218.005",
          "names mshta.exe"
        ]
      },
      {
        "name": "Sibot",
        "attack_id": "S0589",
        "evidence": [
          "uses T1218.005",
          "names mshta.exe"
        ]
      },
      {
        "name": "Xbash",
        "attack_id": "S0341",
        "evidence": [
          "uses T1218.005",
          "names mshta.exe"
        ]
      }
    ],
    "associated_tools": [
      {
        "name": "Covenant",
        "attack_id": "S1155",
        "evidence": [
          "uses T1218.005"
        ]
      },
      {
        "name": "Koadic",
        "attack_id": "S0250",
        "evidence": [
          "uses T1218.005",
          "names mshta.exe"
        ]
      }
    ],
    "technique_only": [],
    "attack_relationships": [
      {
        "source": "APT29",
        "type": "intrusion-set",
        "attack_id": "G0016",
        "description": "APT29 has use `mshta` to execute malicious scripts on a compromised host.",
        "citations": [
          {
            "source_name": "ESET T3 Threat Report 2021",
            "url": "https://www.welivesecurity.com/wp-content/uploads/2022/02/eset_threat_report_t32021.pdf"
          }
        ]
      },
      {
        "source": "APT32",
        "type": "intrusion-set",
        "attack_id": "G0050",
        "description": "APT32 has used mshta.exe for code execution.",
        "citations": [
          {
            "source_name": "Cybereason Oceanlotus May 2017",
            "url": "https://www.cybereason.com/blog/operation-cobalt-kitty-apt"
          },
          {
            "source_name": "Cybereason Cobalt Kitty 2017",
            "url": "https://cdn2.hubspot.net/hubfs/3354902/Cybereason%20Labs%20Analysis%20Operation%20Cobalt%20Kitty.pdf"
          }
        ]
      },
      {
        "source": "APT38",
        "type": "intrusion-set",
        "attack_id": "G0082",
        "description": "APT38 has used a renamed version of `mshta.exe` to execute malicious HTML files.",
        "citations": [
          {
            "source_name": "1 - appv",
            "url": "https://securelist.com/bluenoroff-methods-bypass-motw/108383/"
          }
        ]
      },
      {
        "source": "APT38",
        "type": "intrusion-set",
        "attack_id": "G0082",
        "description": "APT38 has renamed system utilities, such as `rundll32.exe` and `mshta.exe`, to avoid detection.",
        "citations": [
          {
            "source_name": "1 - appv",
            "url": "https://securelist.com/bluenoroff-methods-bypass-motw/108383/"
          }
        ]
      },
      {
        "source": "Confucius",
        "type": "intrusion-set",
        "attack_id": "G0142",
        "description": "Confucius has used mshta.exe to execute malicious VBScript.",
        "citations": [
          {
            "source_name": "TrendMicro Confucius APT Feb 2018",
            "url": "https://www.trendmicro.com/en_us/research/18/b/deciphering-confucius-cyberespionage-operations.html"
          }
        ]
      },
      {
        "source": "Earth Lusca",
        "type": "intrusion-set",
        "attack_id": "G1006",
        "description": "Earth Lusca has used `mshta.exe` to load an HTA script within a malicious.LNK file.",
        "citations": [
          {
            "source_name": "TrendMicro EarthLusca 2022",
            "url": "https://www.trendmicro.com/content/dam/trendmicro/global/en/research/22/a/earth-lusca-employs-sophisticated-infrastructure-varied-tools-and-techniques/technical-brief-delving-deep-an-analysis-of-earth-lusca-operations.pdf"
          }
        ]
      },
      {
        "source": "FIN7",
        "type": "intrusion-set",
        "attack_id": "G0046",
        "description": "FIN7 has used mshta.exe to execute VBScript to execute malicious code on victim systems.",
        "citations": [
          {
            "source_name": "FireEye FIN7 April 2017",
            "url": "https://www.fireeye.com/blog/threat-research/2017/04/fin7-phishing-lnk.html"
          }
        ]
      },
      {
        "source": "Gamaredon Group",
        "type": "intrusion-set",
        "attack_id": "G0047",
        "description": "Gamaredon Group has used `mshta.exe` to execute malicious files.",
        "citations": [
          {